"film_id","title","description","release_year","language_id","rental_duration","rental_rate","length","replacement_cost","rating","last_update","special_features","fulltext"
4,"Affair Prejudice","A Fanciful Documentary of a Frisbee And a Lumberjack who must Chase a Monkey in A Shark Tank",2006,1,5,"2.99",117,"26.99","G","2013-05-26 14:50:58.951","{Commentaries,""Behind the Scenes""}","'affair':1 'chase':14 'documentari':5 'fanci':4 'frisbe':8 'lumberjack':11 'monkey':16 'must':13 'prejudic':2 'shark':19 'tank':20"
5,"African Egg","A Fast-Paced Documentary of a Pastry Chef And a Dentist who must Pursue a Forensic Psychologist in The Gulf of Mexico",2006,1,6,"2.99",130,"22.99","G","2013-05-26 14:50:58.951","{""Deleted Scenes""}","'african':1 'chef':11 'dentist':14 'documentari':7 'egg':2 'fast':5 'fast-pac':4 'forens':19 'gulf':23 'mexico':25 'must':16 'pace':6 'pastri':10 'psychologist':20 'pursu':17"
43,"Atlantis Cause","A Thrilling Yarn of a Feminist And a Hunter who must Fight a Technical Writer in A Shark Tank",2006,1,6,"2.99",170,"15.99","G","2013-05-26 14:50:58.951","{""Behind the Scenes""}","'atlanti':1 'caus':2 'feminist':8 'fight':14 'hunter':11 'must':13 'shark':20 'tank':21 'technic':16 'thrill':4 'writer':17 'yarn':5"
46,"Autumn Crow","A Beautiful Tale of a Dentist And a Mad Cow who must Battle a Moose in The Sahara Desert",2006,1,3,"4.99",108,"13.99","G","2013-05-26 14:50:58.951","{Trailers,Commentaries,""Deleted Scenes"",""Behind the Scenes""}","'autumn':1 'battl':15 'beauti':4 'cow':12 'crow':2 'dentist':8 'desert':21 'mad':11 'moos':17 'must':14 'sahara':20 'tale':5"
50,"Baked Cleopatra","A Stunning Drama of a Forensic Psychologist And a Husband who must Overcome a Waitress in A Monastery",2006,1,3,"2.99",182,"20.99","G","2013-05-26 14:50:58.951","{Commentaries,""Behind the Scenes""}","'bake':1 'cleopatra':2 'drama':5 'forens':8 'husband':12 'monasteri':20 'must':14 'overcom':15 'psychologist':9 'stun':4 'waitress':17"
126,"Casualties Encino","A Insightful Yarn of a A Shark And a Pastry Chef who must Face a Boy in A Monastery",2006,1,3,"4.99",179,"16.99","G","2013-05-26 14:50:58.951","{Trailers}","'boy':18 'casualti':1 'chef':13 'encino':2 'face':16 'insight':4 'monasteri':21 'must':15 'pastri':12 'shark':9 'yarn':5"
56,"Barefoot Manchurian","A Intrepid Story of a Cat And a Student who must Vanquish a Girl in An Abandoned Amusement Park",2006,1,6,"2.99",129,"15.99","G","2013-05-26 14:50:58.951","{Trailers,Commentaries}","'abandon':19 'amus':20 'barefoot':1 'cat':8 'girl':16 'intrepid':4 'manchurian':2 'must':13 'park':21 'stori':5 'student':11 'vanquish':14"
58,"Beach Heartbreakers","A Fateful Display of a Womanizer And a Mad Scientist who must Outgun a A Shark in Soviet Georgia",2006,1,6,"2.99",122,"16.99","G","2013-05-26 14:50:58.951","{""Deleted Scenes"",""Behind the Scenes""}","'beach':1 'display':5 'fate':4 'georgia':21 'heartbreak':2 'mad':11 'must':14 'outgun':15 'scientist':12 'shark':18 'soviet':20 'woman':8"
61,"Beauty Grease","A Fast-Paced Display of a Composer And a Moose who must Sink a Robot in An Abandoned Mine Shaft",2006,1,5,"4.99",175,"28.99","G","2013-05-26 14:50:58.951","{Trailers,Commentaries}","'abandon':21 'beauti':1 'compos':10 'display':7 'fast':5 'fast-pac':4 'greas':2 'mine':22 'moos':13 'must':15 'pace':6 'robot':18 'shaft':23 'sink':16"
75,"Bird Independence","A Thrilling Documentary of a Car And a Student who must Sink a Hunter in The Canadian Rockies",2006,1,6,"4.99",163,"14.99","G","2013-05-26 14:50:58.951","{Commentaries,""Behind the Scenes""}","'bird':1 'canadian':19 'car':8 'documentari':5 'hunter':16 'independ':2 'must':13 'rocki':20 'sink':14 'student':11 'thrill':4"
80,"Blanket Beverly","A Emotional Documentary of a Student And a Girl who must Build a Boat in Nigeria",2006,1,7,"2.99",148,"21.99","G","2013-05-26 14:50:58.951","{Trailers}","'bever':2 'blanket':1 'boat':16 'build':14 'documentari':5 'emot':4 'girl':11 'must':13 'nigeria':18 'student':8"
95,"Breakfast Goldfinger","A Beautiful Reflection of a Student And a Student who must Fight a Moose in Berlin",2006,1,5,"4.99",123,"18.99","G","2013-05-26 14:50:58.951","{Trailers,Commentaries,""Deleted Scenes""}","'beauti':4 'berlin':18 'breakfast':1 'fight':14 'goldfing':2 'moos':16 'must':13 'reflect':5 'student':8,11"
104,"Bugsy Song","A Awe-Inspiring Character Study of a Secret Agent And a Boat who must Find a Squirrel in The First Manned Space Station",2006,1,4,"2.99",119,"17.99","G","2013-05-26 14:50:58.951","{Commentaries}","'agent':12 'awe':5 'awe-inspir':4 'boat':15 'bugsi':1 'charact':7 'find':18 'first':23 'inspir':6 'man':24 'must':17 'secret':11 'song':2 'space':25 'squirrel':20 'station':26 'studi':8"
127,"Cat Coneheads","A Fast-Paced Panorama of a Girl And a A Shark who must Confront a Boy in Ancient India",2006,1,5,"4.99",112,"14.99","G","2013-05-26 14:50:58.951","{Commentaries,""Deleted Scenes""}","'ancient':21 'boy':19 'cat':1 'conehead':2 'confront':17 'fast':5 'fast-pac':4 'girl':10 'india':22 'must':16 'pace':6 'panorama':7 'shark':14"
145,"Chisum Behavior","A Epic Documentary of a Sumo Wrestler And a Butler who must Kill a Car in Ancient India",2006,1,5,"4.99",124,"25.99","G","2013-05-26 14:50:58.951","{Trailers,Commentaries,""Behind the Scenes""}","'ancient':19 'behavior':2 'butler':12 'car':17 'chisum':1 'documentari':5 'epic':4 'india':20 'kill':15 'must':14 'sumo':8 'wrestler':9"
146,"Chitty Lock","A Boring Epistle of a Boat And a Database Administrator who must Kill a Sumo Wrestler in The First Manned Space Station",2006,1,6,"2.99",107,"24.99","G","2013-05-26 14:50:58.951","{Commentaries}","'administr':12 'boat':8 'bore':4 'chitti':1 'databas':11 'epistl':5 'first':21 'kill':15 'lock':2 'man':22 'must':14 'space':23 'station':24 'sumo':17 'wrestler':18"
156,"Clerks Angels","A Thrilling Display of a Sumo Wrestler And a Girl who must Confront a Man in A Baloon",2006,1,3,"4.99",164,"15.99","G","2013-05-26 14:50:58.951","{Commentaries}","'angel':2 'baloon':20 'clerk':1 'confront':15 'display':5 'girl':12 'man':17 'must':14 'sumo':8 'thrill':4 'wrestler':9"
166,"Color Philadelphia","A Thoughtful Panorama of a Car And a Crocodile who must Sink a Monkey in The Sahara Desert",2006,1,6,"2.99",149,"19.99","G","2013-05-26 14:50:58.951","{Commentaries,""Behind the Scenes""}","'car':8 'color':1 'crocodil':11 'desert':20 'monkey':16 'must':13 'panorama':5 'philadelphia':2 'sahara':19 'sink':14 'thought':4"
179,"Conquerer Nuts","A Taut Drama of a Mad Scientist And a Man who must Escape a Pioneer in An Abandoned Mine Shaft",2006,1,4,"4.99",173,"14.99","G","2013-05-26 14:50:58.951","{Commentaries,""Deleted Scenes"",""Behind the Scenes""}","'abandon':20 'conquer':1 'drama':5 'escap':15 'mad':8 'man':12 'mine':21 'must':14 'nut':2 'pioneer':17 'scientist':9 'shaft':22 'taut':4"
182,"Control Anthem","A Fateful Documentary of a Robot And a Student who must Battle a Cat in A Monastery",2006,1,7,"4.99",185,"9.99","G","2013-05-26 14:50:58.951","{Commentaries}","'anthem':2 'battl':14 'cat':16 'control':1 'documentari':5 'fate':4 'monasteri':19 'must':13 'robot':8 'student':11"
193,"Crossroads Casualties","A Intrepid Documentary of a Sumo Wrestler And a Astronaut who must Battle a Composer in The Outback",2006,1,5,"2.99",153,"20.99","G","2013-05-26 14:50:58.951","{Trailers,Commentaries,""Behind the Scenes""}","'astronaut':12 'battl':15 'casualti':2 'compos':17 'crossroad':1 'documentari':5 'intrepid':4 'must':14 'outback':20 'sumo':8 'wrestler':9"
202,"Daddy Pittsburgh","A Epic Story of a A Shark And a Student who must Confront a Explorer in The Gulf of Mexico",2006,1,5,"4.99",161,"26.99","G","2013-05-26 14:50:58.951","{""Deleted Scenes"",""Behind the Scenes""}","'confront':15 'daddi':1 'epic':4 'explor':17 'gulf':20 'mexico':22 'must':14 'pittsburgh':2 'shark':9 'stori':5 'student':12"
212,"Darn Forrester","A Fateful Story of a A Shark And a Explorer who must Succumb a Technical Writer in A Jet Boat",2006,1,7,"4.99",185,"14.99","G","2013-05-26 14:50:58.951","{""Deleted Scenes""}","'boat':22 'darn':1 'explor':12 'fate':4 'forrest':2 'jet':21 'must':14 'shark':9 'stori':5 'succumb':15 'technic':17 'writer':18"
216,"Day Unfaithful","A Stunning Documentary of a Composer And a Mad Scientist who must Find a Technical Writer in A U-Boat",2006,1,3,"4.99",113,"16.99","G","2013-05-26 14:50:58.951","{Trailers,Commentaries,""Deleted Scenes"",""Behind the Scenes""}","'boat':23 'compos':8 'day':1 'documentari':5 'find':15 'mad':11 'must':14 'scientist':12 'stun':4 'technic':17 'u':22 'u-boat':21 'unfaith':2 'writer':18"
217,"Dazed Punk","A Action-Packed Story of a Pioneer And a Technical Writer who must Discover a Forensic Psychologist in An Abandoned Amusement Park",2006,1,6,"4.99",120,"20.99","G","2013-05-26 14:50:58.951","{Commentaries,""Deleted Scenes""}","'abandon':23 'action':5 'action-pack':4 'amus':24 'daze':1 'discov':17 'forens':19 'must':16 'pack':6 'park':25 'pioneer':10 'psychologist':20 'punk':2 'stori':7 'technic':13 'writer':14"
230,"Diary Panic","A Thoughtful Character Study of a Frisbee And a Mad Cow who must Outgun a Man in Ancient India",2006,1,7,"2.99",107,"20.99","G","2013-05-26 14:50:58.951","{Commentaries,""Behind the Scenes""}","'ancient':20 'charact':5 'cow':13 'diari':1 'frisbe':9 'india':21 'mad':12 'man':18 'must':15 'outgun':16 'panic':2 'studi':6 'thought':4"
239,"Dogma Family","A Brilliant Character Study of a Database Administrator And a Monkey who must Succumb a Astronaut in New Orleans",2006,1,5,"4.99",122,"16.99","G","2013-05-26 14:50:58.951","{Commentaries}","'administr':10 'astronaut':18 'brilliant':4 'charact':5 'databas':9 'dogma':1 'famili':2 'monkey':13 'must':15 'new':20 'orlean':21 'studi':6 'succumb':16"
260,"Dude Blindness","A Stunning Reflection of a Husband And a Lumberjack who must Face a Frisbee in An Abandoned Fun House",2006,1,3,"4.99",132,"9.99","G","2013-05-26 14:50:58.951","{Trailers,""Deleted Scenes""}","'abandon':19 'blind':2 'dude':1 'face':14 'frisbe':16 'fun':20 'hous':21 'husband':8 'lumberjack':11 'must':13 'reflect':5 'stun':4"
264,"Dwarfs Alter","A Emotional Yarn of a Girl And a Dog who must Challenge a Composer in Ancient Japan",2006,1,6,"2.99",101,"13.99","G","2013-05-26 14:50:58.951","{Commentaries,""Deleted Scenes""}","'alter':2 'ancient':18 'challeng':14 'compos':16 'dog':11 'dwarf':1 'emot':4 'girl':8 'japan':19 'must':13 'yarn':5"
271,"Easy Gladiator","A Fateful Story of a Monkey And a Girl who must Overcome a Pastry Chef in Ancient India",2006,1,5,"4.99",148,"12.99","G","2013-05-26 14:50:58.951","{Trailers,Commentaries,""Behind the Scenes""}","'ancient':19 'chef':17 'easi':1 'fate':4 'girl':11 'gladiat':2 'india':20 'monkey':8 'must':13 'overcom':14 'pastri':16 'stori':5"
293,"Exorcist Sting","A Touching Drama of a Dog And a Sumo Wrestler who must Conquer a Mad Scientist in Berlin",2006,1,6,"2.99",167,"17.99","G","2013-05-26 14:50:58.951","{Commentaries,""Deleted Scenes"",""Behind the Scenes""}","'berlin':20 'conquer':15 'dog':8 'drama':5 'exorcist':1 'mad':17 'must':14 'scientist':18 'sting':2 'sumo':11 'touch':4 'wrestler':12"
297,"Extraordinary Conquerer","A Stunning Story of a Dog And a Feminist who must Face a Forensic Psychologist in Berlin",2006,1,6,"2.99",122,"29.99","G","2013-05-26 14:50:58.951","{Trailers,Commentaries,""Deleted Scenes""}","'berlin':19 'conquer':2 'dog':8 'extraordinari':1 'face':14 'feminist':11 'forens':16 'must':13 'psychologist':17 'stori':5 'stun':4"
302,"Fantasia Park","A Thoughtful Documentary of a Mad Scientist And a A Shark who must Outrace a Feminist in Australia",2006,1,5,"2.99",131,"29.99","G","2013-05-26 14:50:58.951","{Commentaries}","'australia':20 'documentari':5 'fantasia':1 'feminist':18 'mad':8 'must':15 'outrac':16 'park':2 'scientist':9 'shark':13 'thought':4"
304,"Fargo Gandhi","A Thrilling Reflection of a Pastry Chef And a Crocodile who must Reach a Teacher in The Outback",2006,1,3,"2.99",130,"28.99","G","2013-05-26 14:50:58.951","{""Deleted Scenes""}","'chef':9 'crocodil':12 'fargo':1 'gandhi':2 'must':14 'outback':20 'pastri':8 'reach':15 'reflect':5 'teacher':17 'thrill':4"
313,"Fidelity Devil","A Awe-Inspiring Drama of a Technical Writer And a Composer who must Reach a Pastry Chef in A U-Boat",2006,1,5,"4.99",118,"11.99","G","2013-05-26 14:50:58.951","{Trailers,""Deleted Scenes"",""Behind the Scenes""}","'awe':5 'awe-inspir':4 'boat':25 'chef':20 'compos':14 'devil':2 'drama':7 'fidel':1 'inspir':6 'must':16 'pastri':19 'reach':17 'technic':10 'u':24 'u-boat':23 'writer':11"
371,"Gosford Donnie","A Epic Panorama of a Mad Scientist And a Monkey who must Redeem a Secret Agent in Berlin",2006,1,5,"4.99",129,"17.99","G","2013-05-26 14:50:58.951","{Commentaries}","'agent':18 'berlin':20 'donni':2 'epic':4 'gosford':1 'mad':8 'monkey':12 'must':14 'panorama':5 'redeem':15 'scientist':9 'secret':17"
373,"Graduate Lord","A Lacklusture Epistle of a Girl And a A Shark who must Meet a Mad Scientist in Ancient China",2006,1,7,"2.99",156,"14.99","G","2013-05-26 14:50:58.951","{Trailers,""Behind the Scenes""}","'ancient':20 'china':21 'epistl':5 'girl':8 'graduat':1 'lacklustur':4 'lord':2 'mad':17 'meet':15 'must':14 'scientist':18 'shark':12"
412,"Heavyweights Beast","A Unbelieveable Story of a Composer And a Dog who must Overcome a Womanizer in An Abandoned Amusement Park",2006,1,6,"4.99",102,"25.99","G","2013-05-26 14:50:58.951","{""Deleted Scenes""}","'abandon':19 'amus':20 'beast':2 'compos':8 'dog':11 'heavyweight':1 'must':13 'overcom':14 'park':21 'stori':5 'unbeliev':4 'woman':16"
419,"Hocus Frida","A Awe-Inspiring Tale of a Girl And a Madman who must Outgun a Student in A Shark Tank",2006,1,4,"2.99",141,"19.99","G","2013-05-26 14:50:58.951","{Trailers,""Deleted Scenes"",""Behind the Scenes""}","'awe':5 'awe-inspir':4 'frida':2 'girl':10 'hocus':1 'inspir':6 'madman':13 'must':15 'outgun':16 'shark':21 'student':18 'tale':7 'tank':22"
431,"Hoosiers Birdcage","A Astounding Display of a Explorer And a Boat who must Vanquish a Car in The First Manned Space Station",2006,1,3,"2.99",176,"12.99","G","2013-05-26 14:50:58.951","{Trailers,Commentaries,""Deleted Scenes""}","'astound':4 'birdcag':2 'boat':11 'car':16 'display':5 'explor':8 'first':19 'hoosier':1 'man':20 'must':13 'space':21 'station':22 'vanquish':14"
472,"Italian African","A Astounding Character Study of a Monkey And a Moose who must Outgun a Cat in A U-Boat",2006,1,3,"4.99",174,"24.99","G","2013-05-26 14:50:58.951","{Trailers,Commentaries,""Deleted Scenes""}","'african':2 'astound':4 'boat':22 'cat':17 'charact':5 'italian':1 'monkey':9 'moos':12 'must':14 'outgun':15 'studi':6 'u':21 'u-boat':20"
478,"Jaws Harry","A Thrilling Display of a Database Administrator And a Monkey who must Overcome a Dog in An Abandoned Fun House",2006,1,4,"2.99",112,"10.99","G","2013-05-26 14:50:58.951","{""Deleted Scenes""}","'abandon':20 'administr':9 'databas':8 'display':5 'dog':17 'fun':21 'harri':2 'hous':22 'jaw':1 'monkey':12 'must':14 'overcom':15 'thrill':4"
490,"Jumanji Blade","A Intrepid Yarn of a Husband And a Womanizer who must Pursue a Mad Scientist in New Orleans",2006,1,4,"2.99",121,"13.99","G","2013-05-26 14:50:58.951","{Commentaries,""Behind the Scenes""}","'blade':2 'husband':8 'intrepid':4 'jumanji':1 'mad':16 'must':13 'new':19 'orlean':20 'pursu':14 'scientist':17 'woman':11 'yarn':5"
510,"Lawless Vision","A Insightful Yarn of a Boy And a Sumo Wrestler who must Outgun a Car in The Outback",2006,1,6,"4.99",181,"29.99","G","2013-05-26 14:50:58.951","{""Deleted Scenes"",""Behind the Scenes""}","'boy':8 'car':17 'insight':4 'lawless':1 'must':14 'outback':20 'outgun':15 'sumo':11 'vision':2 'wrestler':12 'yarn':5"
519,"Liberty Magnificent","A Boring Drama of a Student And a Cat who must Sink a Technical Writer in A Baloon",2006,1,3,"2.99",138,"27.99","G","2013-05-26 14:50:58.951","{Commentaries,""Deleted Scenes"",""Behind the Scenes""}","'baloon':20 'bore':4 'cat':11 'drama':5 'liberti':1 'magnific':2 'must':13 'sink':14 'student':8 'technic':16 'writer':17"
554,"Malkovich Pet","A Intrepid Reflection of a Waitress And a A Shark who must Kill a Squirrel in The Outback",2006,1,6,"2.99",159,"22.99","G","2013-05-26 14:50:58.951","{""Behind the Scenes""}","'intrepid':4 'kill':15 'malkovich':1 'must':14 'outback':20 'pet':2 'reflect':5 'shark':12 'squirrel':17 'waitress':8"
559,"Married Go","A Fanciful Story of a Womanizer And a Dog who must Face a Forensic Psychologist in The Sahara Desert",2006,1,7,"2.99",114,"22.99","G","2013-05-26 14:50:58.951","{""Behind the Scenes""}","'desert':21 'dog':11 'face':14 'fanci':4 'forens':16 'go':2 'marri':1 'must':13 'psychologist':17 'sahara':20 'stori':5 'woman':8"
569,"Menagerie Rushmore","A Unbelieveable Panorama of a Composer And a Butler who must Overcome a Database Administrator in The First Manned Space Station",2006,1,7,"2.99",147,"18.99","G","2013-05-26 14:50:58.951","{Trailers,Commentaries,""Deleted Scenes""}","'administr':17 'butler':11 'compos':8 'databas':16 'first':20 'man':21 'menageri':1 'must':13 'overcom':14 'panorama':5 'rushmor':2 'space':22 'station':23 'unbeliev':4"
597,"Moonwalker Fool","A Epic Drama of a Feminist And a Pioneer who must Sink a Composer in New Orleans",2006,1,5,"4.99",184,"12.99","G","2013-05-26 14:50:58.951","{Trailers,""Deleted Scenes""}","'compos':16 'drama':5 'epic':4 'feminist':8 'fool':2 'moonwalk':1 'must':13 'new':18 'orlean':19 'pioneer':11 'sink':14"
609,"Muscle Bright","A Stunning Panorama of a Sumo Wrestler And a Husband who must Redeem a Madman in Ancient India",2006,1,7,"2.99",185,"23.99","G","2013-05-26 14:50:58.951","{""Deleted Scenes""}","'ancient':19 'bright':2 'husband':12 'india':20 'madman':17 'muscl':1 'must':14 'panorama':5 'redeem':15 'stun':4 'sumo':8 'wrestler':9"
612,"Mussolini Spoilers","A Thrilling Display of a Boat And a Monkey who must Meet a Composer in Ancient China",2006,1,6,"2.99",180,"10.99","G","2013-05-26 14:50:58.951","{""Deleted Scenes"",""Behind the Scenes""}","'ancient':18 'boat':8 'china':19 'compos':16 'display':5 'meet':14 'monkey':11 'mussolini':1 'must':13 'spoiler':2 'thrill':4"
638,"Operation Operation","A Intrepid Character Study of a Man And a Frisbee who must Overcome a Madman in Ancient China",2006,1,7,"2.99",156,"23.99","G","2013-05-26 14:50:58.951","{Trailers,Commentaries,""Deleted Scenes"",""Behind the Scenes""}","'ancient':19 'charact':5 'china':20 'frisbe':12 'intrepid':4 'madman':17 'man':9 'must':14 'oper':1,2 'overcom':15 'studi':6"
653,"Panic Club","A Fanciful Display of a Teacher And a Crocodile who must Succumb a Girl in A Baloon",2006,1,3,"4.99",102,"15.99","G","2013-05-26 14:50:58.951","{Commentaries,""Deleted Scenes""}","'baloon':19 'club':2 'crocodil':11 'display':5 'fanci':4 'girl':16 'must':13 'panic':1 'succumb':14 'teacher':8"
692,"Potluck Mixed","A Beautiful Story of a Dog And a Technical Writer who must Outgun a Student in A Baloon",2006,1,3,"2.99",179,"10.99","G","2013-05-26 14:50:58.951","{""Behind the Scenes""}","'baloon':20 'beauti':4 'dog':8 'mix':2 'must':14 'outgun':15 'potluck':1 'stori':5 'student':17 'technic':11 'writer':12"
757,"Sagebrush Clueless","A Insightful Story of a Lumberjack And a Hunter who must Kill a Boy in Ancient Japan",2006,1,4,"2.99",106,"28.99","G","2013-05-26 14:50:58.951","{Trailers}","'ancient':18 'boy':16 'clueless':2 'hunter':11 'insight':4 'japan':19 'kill':14 'lumberjack':8 'must':13 'sagebrush':1 'stori':5"
758,"Saints Bride","A Fateful Tale of a Technical Writer And a Composer who must Pursue a Explorer in The Gulf of Mexico",2006,1,5,"2.99",125,"11.99","G","2013-05-26 14:50:58.951","{""Deleted Scenes""}","'bride':2 'compos':12 'explor':17 'fate':4 'gulf':20 'mexico':22 'must':14 'pursu':15 'saint':1 'tale':5 'technic':8 'writer':9"
760,"Samurai Lion","A Fast-Paced Story of a Pioneer And a Astronaut who must Reach a Boat in A Baloon",2006,1,5,"2.99",110,"21.99","G","2013-05-26 14:50:58.951","{Commentaries}","'astronaut':13 'baloon':21 'boat':18 'fast':5 'fast-pac':4 'lion':2 'must':15 'pace':6 'pioneer':10 'reach':16 'samurai':1 'stori':7"
764,"Saturday Lambs","A Thoughtful Reflection of a Mad Scientist And a Moose who must Kill a Husband in A Baloon",2006,1,3,"4.99",150,"28.99","G","2013-05-26 14:50:58.951","{Commentaries,""Deleted Scenes""}","'baloon':20 'husband':17 'kill':15 'lamb':2 'mad':8 'moos':12 'must':14 'reflect':5 'saturday':1 'scientist':9 'thought':4"
770,"Scissorhands Slums","A Awe-Inspiring Drama of a Girl And a Technical Writer who must Meet a Feminist in The Canadian Rockies",2006,1,5,"2.99",147,"13.99","G","2013-05-26 14:50:58.951","{Commentaries,""Deleted Scenes"",""Behind the Scenes""}","'awe':5 'awe-inspir':4 'canadian':22 'drama':7 'feminist':19 'girl':10 'inspir':6 'meet':17 'must':16 'rocki':23 'scissorhand':1 'slum':2 'technic':13 'writer':14"
778,"Secrets Paradise","A Fateful Saga of a Cat And a Frisbee who must Kill a Girl in A Manhattan Penthouse",2006,1,3,"4.99",109,"24.99","G","2013-05-26 14:50:58.951","{Trailers,Commentaries}","'cat':8 'fate':4 'frisbe':11 'girl':16 'kill':14 'manhattan':19 'must':13 'paradis':2 'penthous':20 'saga':5 'secret':1"
853,"Stranger Strangers","A Awe-Inspiring Yarn of a Womanizer And a Explorer who must Fight a Woman in The First Manned Space Station",2006,1,3,"4.99",139,"12.99","G","2013-05-26 14:50:58.951","{Commentaries,""Deleted Scenes""}","'awe':5 'awe-inspir':4 'explor':13 'fight':16 'first':21 'inspir':6 'man':22 'must':15 'space':23 'station':24 'stranger':1,2 'woman':10,18 'yarn':7"
897,"Torque Bound","A Emotional Display of a Crocodile And a Husband who must Reach a Man in Ancient Japan",2006,1,3,"4.99",179,"27.99","G","2013-05-26 14:50:58.951","{Trailers,Commentaries}","'ancient':18 'bound':2 'crocodil':8 'display':5 'emot':4 'husband':11 'japan':19 'man':16 'must':13 'reach':14 'torqu':1"
903,"Traffic Hobbit","A Amazing Epistle of a Squirrel And a Lumberjack who must Succumb a Database Administrator in A U-Boat",2006,1,5,"4.99",139,"13.99","G","2013-05-26 14:50:58.951","{Trailers,Commentaries}","'administr':17 'amaz':4 'boat':22 'databas':16 'epistl':5 'hobbit':2 'lumberjack':11 'must':13 'squirrel':8 'succumb':14 'traffic':1 'u':21 'u-boat':20"
908,"Trap Guys","A Unbelieveable Story of a Boy And a Mad Cow who must Challenge a Database Administrator in The Sahara Desert",2006,1,3,"4.99",110,"11.99","G","2013-05-26 14:50:58.951","{Commentaries,""Behind the Scenes""}","'administr':18 'boy':8 'challeng':15 'cow':12 'databas':17 'desert':22 'guy':2 'mad':11 'must':14 'sahara':21 'stori':5 'trap':1 'unbeliev':4"
958,"Wardrobe Phantom","A Action-Packed Display of a Mad Cow And a Astronaut who must Kill a Car in Ancient India",2006,1,6,"2.99",178,"19.99","G","2013-05-26 14:50:58.951","{Trailers,Commentaries}","'action':5 'action-pack':4 'ancient':21 'astronaut':14 'car':19 'cow':11 'display':7 'india':22 'kill':17 'mad':10 'must':16 'pack':6 'phantom':2 'wardrob':1"
960,"Wars Pluto","A Taut Reflection of a Teacher And a Database Administrator who must Chase a Madman in The Sahara Desert",2006,1,5,"2.99",128,"15.99","G","2013-05-26 14:50:58.951","{Commentaries,""Behind the Scenes""}","'administr':12 'chase':15 'databas':11 'desert':21 'madman':17 'must':14 'pluto':2 'reflect':5 'sahara':20 'taut':4 'teacher':8 'war':1"
969,"West Lion","A Intrepid Drama of a Butler And a Lumberjack who must Challenge a Database Administrator in A Manhattan Penthouse",2006,1,4,"4.99",159,"29.99","G","2013-05-26 14:50:58.951","{Trailers}","'administr':17 'butler':8 'challeng':14 'databas':16 'drama':5 'intrepid':4 'lion':2 'lumberjack':11 'manhattan':20 'must':13 'penthous':21 'west':1"
